"result #"	"search engine"	query	"article title"	"article url"	"article description"	"total nr of results (best guess)"
0	duckduckgo	"republican candidates 2024"	"Here's a list of Republican 2024 presidential candidates : NPR"	https://www.npr.org/2023/03/08/1160113954/2024-republican-presidential-candidates-who-is-running-tracker	"Elections 2024Republican presidential candidates: A list of who is running Updated January 21, 20245:10 PM ET By Domenico Montanaro , Jacob Fenton Republicans could have a crowded field of..."	0
1	duckduckgo	"republican candidates 2024"	"2024 Republican presidential candidates | CNN Politics"	https://www.cnn.com/election/2024/presidential-candidates	"Doug Burgum Mike McCleary/The Bismarck Tribune/AP North Dakota Gov. Doug Burgum ended his campaign for the Republican presidential nomination in December 2023 and endorsed former President Donald..."	0
2	duckduckgo	"republican candidates 2024"	"2024 Republican Party presidential candidates - Wikipedia"	https://en.wikipedia.org/wiki/2024_Republican_Party_presidential_candidates	"Results Endorsements Convention Republican Party Primaries Candidates Debates and forums Polling national statewide Endorsements Results Convention Third parties Libertarian Party primaries Green Party primaries"	0
3	duckduckgo	"republican candidates 2024"	"Who Are the 2024 Presidential Election Candidates? - The New York Times"	https://www.nytimes.com/interactive/2023/us/politics/presidential-candidates-2024.html	"Who Are the 2024 Presidential Election Candidates? - The New York Times Advertisement Who's Running for President in 2024? and Updated Jan. 21, 2024 Leer en español Democrats Biden..."	0
4	duckduckgo	"republican candidates 2024"	"National : President: Republican primary : 2024 Polls"	https://projects.fivethirtyeight.com/polls/president-primary-r/2024/national/	"See the latest national polling averages for the 2024Republican primary, accounting for each poll's recency, sample size, methodology and house effects. Find out who's ahead in the national polls, state polls and favorability polls for the top contenders, including Trump, Haley, DeSantis and Haley."	0
5	duckduckgo	"republican candidates 2024"	"The 2024 presidential candidates: Who's running from both sides"	https://www.nbcnews.com/politics/2024-elections/presidential-candidates-tracker	"The Republicans Donald Trump Nikki Haley Ron DeSantis Asa Hutchinson Vivek Ramaswamy Chris Christie Doug Burgum Tim Scott Mike Pence Larry Elder Perry Johnson Will Hurd Francis Suarez The Democrats..."	0
6	duckduckgo	"republican candidates 2024"	"Who's running for president? Here are the major 2024 candidates | AP News"	https://apnews.com/article/presidential-candidates-2024-301db5ce310cafc97025682b39ceac6e	"FILE - Republican presidential candidate former UN Ambassador Nikki Haley speaks during a campaign event in Derry, N.H., Jan. 21, 2024. Two major Republicancandidates are left competing for their party's 2024 presidential nomination after the departure of Florida Gov. Ron DeSantis from the race."	0
7	duckduckgo	"republican candidates 2024"	"The top 10 Republican presidential candidates for 2024, ranked"	https://www.washingtonpost.com/politics/2023/07/29/top-10-republican-presidential-candidates-2024-ranked/	"The top 10 Republican presidential candidates for 2024, ranked Analysis by Aaron Blake Staff writer July 29, 2023 at 10:00 a.m. EDT Sen. Tim Scott (R-S.C.) shaking hands with then-President..."	0
8	duckduckgo	"republican candidates 2024"	"Republican Candidates 2024: Meet the GOP Presidential Hopefuls - POLITICO"	https://www.politico.com/interactives/2023/republican-candidates-2024-gop-presidential-hopefuls-list/	"A scouting report on the three categories of GOP presidential hopefuls in 2024: the favorites, the contenders and the long shots. Learn about their chances, challenges and strategies to capture the nomination and challenge Joe Biden."	0
9	duckduckgo	"republican candidates 2024"	"Here are the Republicans considering 2024 presidential runs"	https://www.cnn.com/2023/02/14/politics/2024-republican-presidential-contenders-list/index.html	"Donald Trump, Nikki Haley, Ron DeSantis, Mike Pence, Tim Scott, Ted Cruz, Glenn Youngkin, Chris Sununu, Kristi Noem, Greg Abbott, Larry Hogan, Chris Christie, Asa Hutchinson, Mike Pompeo, Liz..."	0
10	duckduckgo	"republican candidates 2024"	"President: Republican primary : 2024 Polls | FiveThirtyEight"	https://projects.fivethirtyeight.com/polls/president-primary-r/2024/	"Updating average for each Republicancandidate in 2024 primary polls, accounting for each poll's recency, sample size, methodology and house effects. KEY. ... Organizations are considered partisan if they operate on behalf of a candidate, party, campaign committee, PAC, ..."	0
11	duckduckgo	"republican candidates 2024"	"2024 Republican Party presidential primaries - Wikipedia"	https://en.wikipedia.org/wiki/2024_Republican_Party_presidential_primaries	"Democratic Party Primaries Candidates Debates and forums Polling Results Endorsements Convention Republican Party Primaries Candidates Debates and forums Polling national statewide Endorsements Results Convention Third parties Libertarian Party primaries Green Party primaries Third-party and independent candidates polling Related races Senate House"	0
12	duckduckgo	"republican candidates 2024"	"Who's running for president in 2024? The Republican and Democratic ..."	https://www.theguardian.com/us-news/ng-interactive/2024/jan/21/presidential-election-candidates-biden-trump	"burgum christie desantis elder hurd hutchinson johnson pence ramaswamy scott suarez Republicans Ryan Binkley Businessman and pastor Binkley, a Texas businessman, is a long-shot candidate who is..."	0
13	duckduckgo	"republican candidates 2024"	"2024 Republican presidential candidates | CNN Politics"	https://www.cnn.com/2023/05/24/politics/2024-republican-presidential-candidates-what-matters/index.html	"Donald Trump gallery In pictures: Former President Donald Trump Announced campaign: November 2022 The divisive former president is the prohibitive Republican frontrunner despite his efforts to..."	0
14	duckduckgo	"republican candidates 2024"	"Presidential candidates, 2024 - Ballotpedia"	https://ballotpedia.org/Presidential_candidates,_2024	"As of January 2024, Ballotpedia has identified three noteworthy Democratic presidential candidates and three noteworthy Republicancandidates. We identify noteworthy primary candidates based on previous or current officeholder status, previous presidential ballot access, media coverage, and primary debate polling and fundraising thresholds."	0
15	duckduckgo	"republican candidates 2024"	"President: general election : 2024 Polls | FiveThirtyEight"	https://projects.fivethirtyeight.com/polls/president-general/2024/	"Kari Lake is a Republican Party candidate for office. Biden: 41%. Biden: 41%. Biden. 41%. Trump. 45%. 45%. Trump : Trump +4: Jan. 30, 2024. President: general election, North Carolina, 2024. Jan. 26-31. 760: RV: ... presidential approval and national 2024Republican primary averages is available for download here. Notice any bugs or missing ..."	0
16	duckduckgo	"republican candidates 2024"	"Who is running for president? Meet the 2024 presidential candidates."	https://www.usatoday.com/story/news/politics/elections/2023/12/14/2024-presidential-candidates-republicans-democrats/71691815007/	"Anna Kaufman Veronica Bravo USA TODAY The 2024 election cycle has kicked off, and the race is heating up even as Election Day is months away . President Joe Biden is seeking another term in the..."	0
17	duckduckgo	"republican candidates 2024"	"Nevada GOP primary: 'None of these candidates' option wins, Haley loses ..."	https://apnews.com/article/nevada-2024-presidential-primary-biden-trump-haley-d731bf8ab1e7d4a7379c07d3a37b581b	"Updated 10:02 PM PST, February 6, 2024. LAS VEGAS (AP) — Nikki Haley was swamped Tuesday in Nevada's symbolic Republican presidential primary as GOP voters resoundingly picked the ""none of these candidates"" option on the ballot in a repudiation of the former U.N. ambassador who is the last remaining major rival to front-runner Donald Trump."	0
18	duckduckgo	"republican candidates 2024"	"'None of these candidates' takes the Nevada Republican primary, dealing ..."	https://www.npr.org/2024/02/07/1229716545/none-of-these-candidates-nevada-republican-primary-nikki-haley	"Republican presidential candidate former UN Ambassador Nikki Haley speaks during a campaign rally on Monday in Spartanburg, S.C. Haley has focused her campaign attention and resources on South ..."	0
19	duckduckgo	"republican candidates 2024"	"Haley loses Republican Nevada primary to 'none of these candidates ..."	https://www.reuters.com/world/us/nikki-haley-set-win-nevada-republican-primary-victory-will-be-hollow-2024-02-06/	"Feb 6 (Reuters) - Republican presidential candidate Nikki Haley suffered an embarrassing defeat in Nevada's primary on Tuesday, finishing behind ballots marked ""none of these candidates"" by ..."	0
20	duckduckgo	"republican candidates 2024"	"'None of these candidates' defeats Nikki Haley in Nevada Republican ..."	https://www.cnbc.com/2024/02/07/nevada-republican-primary-nbc-news-projects.html	"Republican presidential candidate, former U.N. Ambassador Nikki Haley speaks during a campaign rally at the Indigo Hall and Events venue on Feb. 5, 2024 in Spartanburg, South Carolina."	0
21	duckduckgo	"republican candidates 2024"	"The Latest Updates On The 2024 Republican Presidential Primary"	https://projects.fivethirtyeight.com/2024-republican-primary-updates/	"Follow the latest news and analysis on the 2024Republican presidential primary, including national and state polls, endorsement points, dates and results. See who's ahead in key race metrics, such as net favorability, favorability and endorsement points, and how they compare to previous candidates."	0
22	duckduckgo	"republican candidates 2024"	"2024 Election: News, polls and results | CNN Politics"	https://www.cnn.com/election/2024	"2024 election guide: Presidential candidates, polls, primaries and caucuses, voter information and results for November 5, 2024 ... It takes 1,215 of 2,429 delegates to win the Republican ..."	0
23	duckduckgo	"republican candidates 2024"	"Haley loses Nevada GOP primary to 'none of these candidates' as Trump skips"	https://www.nbcnews.com/politics/2024-election/haley-loses-nevada-republican-primary-without-trump-rcna137367	"Republican presidential candidate Nikki Haley delivers remarks at her primary-night rally at the Grappone Conference Center, in Concord, N.H., on January 23, 2024. Brandon Bell / Getty Images file."	0
24	duckduckgo	"republican candidates 2024"	"Navy veteran Hung Cao enters GOP race to challenge Virginia Sen. Tim ..."	https://apnews.com/article/hung-cao-tim-kaine-senate-virginia-2024-election-b9a719a3a7278f54cc2f09cd8f782f1e	"Retired Navy captain Hung Cao participates in a debate on Oct. 20, 2022, in Leesburg, Va. Cao announced plans Tuesday, July 18, 2023 to seek the 2024Republican nomination to challenge Democratic U.S. Sen. Tim Kaine. (AP Photo/Matthew Barakat, File) RICHMOND, Va. (AP) — Retired Navy combat veteran Hung Cao, who ran an energetic but ..."	0
25	duckduckgo	"republican candidates 2024"	"Nikki Haley Loses Nevada GOP Primary to 'None of These Candidates'"	https://www.businessinsider.com/nikki-haley-loses-nevada-gop-primary-none-of-these-candidates-2024-2?op=1	"Haley was the only currently running major presidential candidate to appear on the state's GOP primary ballot. ... 2024-02-07T05:10:09Z An curved arrow pointing right. Share ..."	0
26	duckduckgo	"republican candidates 2024"	"Candidates Tournament 2024 - Wikipedia"	https://en.wikipedia.org/wiki/Candidates_Tournament_2024	"The 2024Candidates Tournament will be an eight-player chess tournament, held to determine the challenger for the World Chess Championship 2024.It is scheduled to take place at The Great Hall in Toronto, Canada, from April 3-22, 2024. The event will be held alongside the Women's Candidates Tournament.. As with every Candidates tournament since 2013, it will be a double round-robin tournament."	0
27	duckduckgo	"republican candidates 2024"	"2024 United States presidential election - Wikipedia"	https://en.wikipedia.org/wiki/2024_United_States_presidential_election	"The 2024 United States presidential election will be the 60th quadrennial presidential election, scheduled for Tuesday, November 5, 2024. Voters will elect a president and vice president for a term of four years. Incumbent President Joe Biden, a member of the Democratic Party, is running for re-election. His predecessor Donald Trump, a member of the Republican Party, is running for re-election ..."	0
28	duckduckgo	"republican candidates 2024"	"Latest 2024 Republican Primary Polls - 270toWin"	https://www.270towin.com/polls/latest-2024-republican-primary-polls/	"February 1, 2024. There will be four vacancies in the House; one of them to be filled via a special election on February 13. Live Results: Legislative Special Elections in Michigan, South Carolina, and Texas. January 30, 2024. The Texas race is a runoff between two Republicans; there are also two district primaries in Michigan and one in South ..."	0
29	duckduckgo	"republican candidates 2024"	"2024 Presidential election calendar: Key dates and events - CNN"	https://www.cnn.com/election/2024/calendar	"Key dates for the 2024 presidential election, including voter deadlines, debates, Republican and Democratic conventions, and state primary and caucus events"	0
30	duckduckgo	"republican candidates 2024"	"The top 10 Republican presidential candidates for 2024, ranked"	https://www.washingtonpost.com/politics/2023/01/14/top-10-republican-presidential-candidates-2024-ranked/	"The top 10 Republican presidential candidates for 2024, ranked. Florida Gov. Ron DeSantis, left, with his wife, Casey, and their children Mason, Madison and Mamie during an inauguration ceremony ..."	0
31	duckduckgo	"republican candidates 2024"	"8 candidates qualify for first 2024 Republican presidential debate - CNN"	https://www.cnn.com/2023/08/21/politics/milwaukee-rnc-presidential-debate-candidates/index.html	"Eight Republicans have qualified for the party's first 2024 presidential primary debate Wednesday night, the Republican National Committee announced Monday evening.. The list includes North ..."	0
32	duckduckgo	"republican candidates 2024"	"The top 10 Republican presidential candidates for 2024, ranked"	https://www.washingtonpost.com/politics/2023/09/03/republican-presidential-rankings-2024/	"Republican delegate count: GOP candidates for president compete to earn enough delegates to secure their party's nomination. We're tracking the Republican2024 delegate count ."	0
33	duckduckgo	"republican candidates 2024"	"The top 10 GOP presidential candidates for 2024, ranked"	https://www.washingtonpost.com/politics/2022/05/21/top-2024-gop-candidates/	"Advertisement. 6. Ted Cruz: Speaking of Republicans who have endorsed against Trump's preferred candidate, the Texas senator stumped for Dave McCormick over Trump's choice of Mehmet Oz just ..."	0
34	duckduckgo	"republican candidates 2024"	"Ranking the 2024 Republican presidential candidates"	https://thehill.com/homenews/campaign/4321996-2024-gop-presidential-candidates-rankings/	"Ranking the 2024Republican presidential candidates. Biden's nursing home staffing rules divide Democrats ahead of 2024. Second, DeSantis has sputtered. The central thesis of the Florida ..."	0
35	duckduckgo	"republican candidates 2024"	"Ranking the 2024 Republican presidential field | CNN Politics"	https://www.cnn.com/2022/09/21/politics/2024-republican-presidential-rankings-trump-desantis/index.html	"Ranking the 2024Republican field. Link Copied! Former President Donald Trump speaks at a rally in Youngstown, Ohio, on September 17, 2022. Just as Donald Trump began to look vulnerable in a ..."	0
36	duckduckgo	"republican candidates 2024"	"The top 10 Republican presidential candidates for 2024, ranked"	https://www.washingtonpost.com/politics/2022/08/20/top-ten-republican-2024-candidates/	"The top 10 Republican presidential candidates for 2024, ranked. Posters of former president Donald Trump and Florida Gov. Ron DeSantis are displayed during the first day of the CPAC conference in ..."	0
37	duckduckgo	"republican candidates 2024"	"Who Is Running for President in 2024? - People.com"	https://people.com/politics/2024-presidential-candidates/	"Sen. Tim Scott. Chip Somodevilla/Getty. Age: 57 Party: Republican Candidacy: Confirmed South Carolina Sen. Tim Scott has potential to be a strong candidate in the 2024 presidential race, proving ..."	0
38	duckduckgo	"republican candidates 2024"	"Who is Vivek Ramaswamy, the youngest candidate at the GOP debate? - NPR"	https://www.npr.org/2023/05/19/1176892623/vivek-ramaswamy-candidate-president-2024	"2024Republican presidential candidates: A list of who is or may be running. He rejects the notion that ""diversity is our strength"" and believes that society has become too focused on race and ..."	0
39	duckduckgo	"republican candidates 2024"	"4 Republicans qualify for fourth 2024 presidential debate"	https://www.cnn.com/2023/12/04/politics/fourth-gop-debate-candidates/index.html	"CNN —. Four candidates have qualified for the fourth GOP presidential primary debate taking place Wednesday night in Alabama, the Republican National Committee and debate broadcaster NewsNation ..."	0
40	duckduckgo	"republican candidates 2024"	"Who's running for president in 2024 and who has dropped out"	https://abcnews.go.com/Politics/running-president-2024/story?id=96849127	"The 2024 presidential race has taken shape, with former President Joe Biden seeking reelection and President Donald Trump mounting a comeback bid for the White House-- while facing GOP competition ..."	0
41	duckduckgo	"republican candidates 2024"	"US election 2024: who are the Republican presidential candidates?"	https://www.ft.com/content/c0ac9d59-2285-4efc-b786-355a10ff3661	"Governor of Florida. DeSantis, 45, had been seen as the Republican best positioned to challenge Trump for the party's nomination in 2024. As well as being a graduate of Yale University and ..."	0
42	duckduckgo	"republican candidates 2024"	"Who's running for president? See a rundown of the 2024 candidates"	https://apnews.com/article/2024-presidential-candidates-who-is-running-e89fbfee94e7e7980594a9ce3994fec7	"See a rundown of the 2024candidates. FILE - The White House is seen reflected in a puddle, Saturday, Sept. 3, 2022, in Washington. With roughly a year and a half until the 2024 presidential contest, the field of candidates is largely set. Former President Donald Trump and Florida Gov. Ron DeSantis have dominated the early Republican race, but ..."	0
43	duckduckgo	"republican candidates 2024"	"Why Trump Is Favored To Win The 2024 Republican Presidential Primary"	https://fivethirtyeight.com/features/trump-2024-president/	"First, Trump remains popular and influential among Republican voters. According to Civiqs, 80 percent of registered Republican voters have a favorable view of the former president, and only 11 ..."	0
44	duckduckgo	"republican candidates 2024"	"2024 Presidential Debates: Track GOP Candidates, Schedules ... - POLITICO"	https://www.politico.com/2024-election/presidential-debate-gop-candidates-schedule-moderators-polls-tracker/	"2024 Presidential Debates: Track GOP Candidates, Schedules, Moderators &amp; Polls. We're tracking every presidential candidate who qualifies for the 2024Republican primary debates — and who will ..."	0
45	duckduckgo	"republican candidates 2024"	"The GOP presidential field is largely set for 2024. Here's ... - PBS"	https://www.pbs.org/newshour/politics/the-gop-presidential-field-is-largely-set-for-2024-heres-where-the-contenders-stand	"Politics Jun 8, 2023 2:02 PM EST. NEW YORK (AP) — After a trio of new announcements this week, the Republican Party's 2024 presidential field is all but set. A handful of stragglers may jump ..."	0
46	duckduckgo	"republican candidates 2024"	"Highlights, analysis from the first Republican presidential debate"	https://www.washingtonpost.com/politics/2023/08/23/republican-presidential-debate/	"Republican delegate count: GOP candidates for president compete to earn enough delegates to secure their party's nomination. We're tracking the Republican2024 delegate count ."	0
47	duckduckgo	"republican candidates 2024"	"2024 Primary Elections Calendar - NBC News"	https://www.nbcnews.com/politics/2024-primary-elections/calendar	"2024 Primary Elections Calendar. The Republican presidential primary began on Jan. 15 with the Iowa caucuses followed by New Hampshire. Former President Donald Trump won both contests. In a bid to ..."	0
48	duckduckgo	"republican candidates 2024"	"2024 Presidential Candidates Fast Facts | CNN Politics"	https://www.cnn.com/2023/03/10/politics/2024-presidential-candidates-fast-facts/index.html	"Here's a look at the 2024 presidential candidates and key dates in their campaigns. RepublicanCandidates Donald Trump - 45th president of the United States Primary Campaign Committee - Donald J ..."	0
49	duckduckgo	"republican candidates 2024"	"Ranking the GOP's top 10 presidential candidates"	https://thehill.com/homenews/campaign/3863222-ranking-the-gops-top-10-presidential-candidates/	"Former United Nations Ambassador Nikki Haley this week became the second major Republicancandidate for president in 2024, joining former President Trump in a field that is sure to grow. Other pote…"	0
